{
	"$schema": "../filament-sensor-definition-schema.json",
	"type": "filament-sensor",
	"title": "Orbiter Smart Filament Sensor",
	"description": "Filament sensor for Orbiter extruders with unload button and tangle detection",
	"manufacturer": "LDO",
	"template": "orbiter-sensor.ts",
	"templateOptions": {
		"isSmart": true
	}	
}